{
  "decisionSchemaVersion": "1.1",
  "decisionKind": "FIXTURE_TRANSLATION_DECISION",
  "selectedRendering": "測試譯文 A",
  "ambiguityStrategy": "PRESERVE_AMBIGUITY",
  "candidateRenderings": [
    {
      "candidateId": "A",
      "rendering": "測試譯文 A",
      "status": "SELECTED",
      "reasonSummary": "Fixture only"
    },
    {
      "candidateId": "B",
      "rendering": "測試譯文 B",
      "status": "ALTERNATIVE",
      "reasonSummary": "Fixture only"
    }
  ],
  "notes": "This fixture validates shape only and is not a scholarly translation.",
  "translationSourceBasisId": "61616161-6161-4616-8616-616161616161",
  "translationPolicyVersionId": "62626262-6262-4626-8626-626262626262",
  "targetLanguageTag": "zh-Hant"
}
